Variable,Type,Sensitive,Default,Condition,Example,Description
INPUT_PATH,str,,/home/app/inputs,,/path/to/directory,Path to directory containing input files
OUTPUT_PATH,str,,/home/app/outputs,,/path/to/directory,Path to directory where to save output files
LOG_LEVEL,str,,INFO,,INFO,"Log level. Supported values: DEBUG, INFO, ERROR, WARNING, CRITICAL"
LOG_PATH,str,,/home/app/logs,,/path/to/directory,Path to directory containing log files if enabled
LOG_TO_FILE,bool,,false,,true,Whether to export logs to a file
