Variable,Type,Sensitive,Default,Condition,Example,Description
MAPPINGS_PATH,str,,\<unset>,,C:\:/mnt,List of mappings of Windows paths to Linux paths
INPUT_PATH,str,,/app/input,,/path/to/directory,Path to directory containing input files
OUTPUT_PATH,str,,/app/output,,/path/to/directory,Path to directory where to save output files
LOG_LEVEL,str,,INFO,,INFO,"Log level. Supported values: DEBUG, INFO, ERROR, WARNING, CRITICAL"
LOG_PATH,str,,/app/log,,/path/to/directory,Path to directory containing log files if enabled
LOG_TO_FILE,bool,,false,,true,Whether to export logs to a file
